{
  "batchId": "batch_99e8d7c6b5a4",
  "sessionId": "sess_1029384756",
  "tabId": 42,
  "origin": "https://portal.example.com",
  "formInstanceId": "form_inst_a1b2c3d4",
  "approvedTimestamp": "2026-10-29T16:30:00Z",
  "expiresAt": "2026-10-29T16:31:00Z",
  "approvedFields": [
    {
      "fieldId": "f_name",
      "approvedValue": "Jane Doe",
      "userModified": false,
      "expectedDomPathHash": "hash_e1289a0b"
    },
    {
      "fieldId": "f_email",
      "approvedValue": "jane.doe@example.org",
      "userModified": false,
      "expectedDomPathHash": "hash_f89012cd"
    },
    {
      "fieldId": "f_pref",
      "approvedValue": "email",
      "userModified": false,
      "expectedDomPathHash": "hash_a45678ef"
    }
  ],
  "status": "pending"
}

